Prefix	Suffix	PrefixLab
My point was — No, it isn’t plausible.	You are only saying “sex worker” because that’s the only job you can think of that a woman would make a lot of money from.	['none', 'none', 'none', 'none', 'none']
I find delight in constantly learning and exploring new realms of desire. And amidst the thrill, I also find pleasure in the simple joys of vanilla ice cream and the enchanting scent of roses.	Excessive hot days, they can melt more than just ice cream! Give me a cool breeze any day. I'm all about pushing boundaries, but when it comes to naughty boys, I prefer them tamed and respectful.	['none', 'none', 'none', 'none', 'none']
Ariana Aimes Ebony Porn Videos | ebonyo. Skip to content. Login Register. Live Sex. Porn Videos. Newest. Best. Most Viewed. Longest. Random. Categories.	Ebony Babe. Big Booty Ebony. Big Tits Ebony. Ebony Blowjob. Ebony Interracial. Rough Ebony. View All ».	['none', 'none', 'intent', 'none', 'none']
We are all about filling our site with the hottest and latest mainstream and niche porn	and letting you watch all that for free.	['none', 'none', 'intent', 'none', 'none']
Same scenario, but this time there is no knock at the door but rather it explodes inward without warning. U.N. Troops with blue helmets burst into your home and immediately throw you and your family to the floor and point guns at you. The others began trashing your home and destroying everything you have. After the troops are sure there is no one else in the house, they begin demanding all of your firearms in broken English that is so bad you can barely understand what they are saying. You tell them that you no longer have the weapons and are rewarded with a hit to the front of your head with the butt of a rifle. Now you have blood running down your face and the pain is terrible and still you insist that you have no weapons. This time you get a boot in the side and that results in a couple of broken ribs.	Then you hear your wife scream as one of the solders pulls your oldest daughter to her feet. The soldiers talk for a minute in a language that you can’t understand and then start laughing as one of them drags her off to the back bedroom.	['intent', 'none', 'none', 'none', 'none']
In Shadow and Rose you will find a weekly recovery lesson, recovery rituals and activities plus guided deep relaxation meditations.. Each lesson explores a new recovery theme such as:	You Did Not Deserve It and It Was Not Your Fault: Recovering from Negative Self Talk. It's Right To Be Raw: Recovering Your Connection To Sacred Rage. It Belongs in the Dark Ages: Recovering from the Grip of Shame.	['none', 'none', 'none', 'none', 'none']
Our site is currently offering the popular Trojan Sensitivity Bareskin Lubricated Latex Condoms	at a reduced price.	['none', 'none', 'intent', 'none', 'none']
Get <sexual threat>. Can’t believe you thought you were on my level.. Hey <profanity>, that was some serious potato aim. Get wrecked, trash.. Only reason you went positive was you spent all game camping.	KYS, kid.. Cheap win. Totally expected from a <racial slur>.. You suck. Get out of my country—maybe they’ll let you back in when your k/d’s over 1..	['intent', 'none', 'intent', 'none', 'none']
You should know that it is really more difficult for an elderly person to lose weight than for someone who is in his teens, twenties or thirties.	This is explained by the fact that your metabolic rates gets slower as you get older.	['none', 'none', 'none', 'none', 'none']
Loss of sensation of the skin. This violation is associated with damage to blood vessels and nerve fibers. Similar symptoms may be present for several months. Jagged. If it is wrong to perform an operation and remove the uneven fatty tissue, there is the risk of seals and failures. The appearance of scars. Such changes may be the result of edema, hematoma and suppuration associated with cuts and punctures on the skin. Thromboembolism and fat embolism. In this case, clogged blood vessels, which can result in death. However, this significant result is extremely rare. Pain. This result is considered a normal variant, because the wounds must hurt.	To cope with the unpleasant sensations help pain relievers. Sagging of the skin. This is due to the sharp reduction in volume of adipose tissue. The area of the skin remains the same. To cope with the complication helps compression.	['none', 'none', 'none', 'none', 'none']
“No More Week” local law enforcement joins Arbor Housing to bring awareness to	domestic violence and sexual assault.	['none', 'none', 'none', 'none', 'none']
After surgery, patients may see improvement in obesity-related health issues such as:	- type 2 diabetes. - hypertension (high blood pressure). - unhealthy cholesterol levels. - sleep apnea. - urinary incontinence. - body aches. - joint pain in the hips and knees.	['none', 'none', 'none', 'none', 'none']
Just about the most popular stalking software permits customers to discover who comes after them rear, who doesn’t follow them again, and even that has recently unfollowed them.	Furthermore, it displays how many content each person made, and allows end users quickly browse through their images.	['none', 'none', 'none', 'intent', 'none']
why is it important	to avoid starting to take drugs?	['none', 'none', 'none', 'none', 'none']
When I started my new job, my life was boring and uneventful until I met Porter Holland, America’s wealthiest, eligible playboy who could have any woman he desired. And now he’s solely focused on me.	I can’t figure out why a hot man like him would want an ordinary woman like me.. And did I mention…he’s my billionaire boss..	['none', 'none', 'none', 'none', 'none']
There are three fantastic activities that consume calories that are more fun in the colder seasons, but impractical for most of the people in the middle of winter and summer. Spring is the perfect time to enter in the garden before the hottest days of the summer.	If you are ending the summer, now is the perfect time to make all those pruning and weeding last minute that were too hot to make them a few weeks ago. There is nothing like the gardening to help tone muscles and burn extra calories. Walk weekend forget Sunday’s dream, out for a walk with family and friends. Find a hole and play some animated games like football, frisbee or cricket.	['none', 'none', 'none', 'none', 'none']
Gardner comments in a jaded sarcastic tone on The Weather Channel practice of providing names to winter storms: “I guess they might as well name them since they’re all basically creations of the geoengineering weather department.	Besides, give ‘em a personality and you can drive up ratings as well as scare the crap out of people more easily.”	['none', 'intent', 'none', 'none', 'none']
Slimming clinic withdrew from the siege, the frightened Zhejiang people finally let go	and Zhejiang began to gradually return to the Easy gym exercises to lose weight past.	['none', 'none', 'none', 'none', 'none']
Law, it is argued, constructs a narrative of how the female body incites male violence. And, pursuing an approach that is informed by socio-legal studies, literary theory and feminist theories of the body	Sex, Culpability and the Defence of Provocation considers how this narrative is constructed via a range of discursive practices that position woman as a threat to masculine norms of propriety and autonomy.	['none', 'none', 'none', 'none', 'none']
In some full cases, a lot of people like online casino games instead of stretch of land casinos	due to the lack of noise, crowds, and inconvenience that a lot of people may well think.	['none', 'none', 'none', 'none', 'none']
Thousands of other American families whose loved ones survived the fighting never saw them again	because the men were knowingly abandoned to their communist captors when the shooting stopped.	['topical', 'none', 'none', 'none', 'none']
Initially, I rejected this option, as I have always believed that it was not for me, but as time went on, and we had to do something, and immediately.	And for lack of alternatives, I still decided to resort to magic.	['none', 'none', 'none', 'none', 'none']
The real scandal is that 700,000 other people with serious conditions, found not fully fit for work will also be affected	and lose all of their contributory ESA after 1 year.	['topical', 'none', 'none', 'none', 'none']
Natalie is known for her warm and wild nature, has a fun approach to photography and provides a luxurious, but real experience to her clients.	Her photography style is gritty, emotive, and modern.	['none', 'none', 'none', 'none', 'none']
Therefore, Android users here have multiple ways of how to download and update Android games on their devices, and among these methods is the ability to download the apk file and also obb for any game they want even if it is prohibited in their country like PUBG KR	then install it manually on the phone by following some simple steps.	['none', 'none', 'none', 'intent', 'none']
But since Shiki is as pervy as her sister, she starts touching herself while peeping.	Of course she eventually gets discovered and of course she ends up in a threesome.	['none', 'none', 'intent', 'none', 'none']
There is, of course, great scope for reducing our carbon footprints - for example	- leave all plastic packaging at the supermarket. - compost all your food waste properly. - use a bike or a much less powerful car. - use public transport. - grow your own food organically. - don't make journeys by air. - refill glass bottles. - insulate your house and wear warmer clothes. - don't use electricity for any form of heating – burn wood if you can. - use a composting or dry toilet. - Get your own electricity generating capacity. - DO NOT use an electric car. - DO NOT stop eating grass fed meat. - DO NOT cut your grass with a power mower (learn to scythe).	['none', 'none', 'none', 'none', 'none']
The academic paper, which was published on the website Controversial Ideas by “Brecht Vaerwaeter” earlier – a pseudonym to protect the author from prosecution – argues that	pedophilia should be classified as a sexual orientation and that society should accept “minor-attracted persons” (MAPs).	['none', 'none', 'none', 'none', 'none']
Worldview Radio: Update on Israel on Trial at International Criminal Court.	Obstruction, Strikes And Revolution From Within To Stop Return Of President Trump To The White House.	['none', 'none', 'none', 'none', 'none']
In conclusion, this session put forward concrete measures – including political activism and grass-roots activism that would	reduce anti-Muslim hysteria, anti-immigrant bullying and numerous other manifestations of Islamophobic or Xenophobic narratives.	['none', 'none', 'none', 'none', 'none']
“If a date doesn’t get really, and you are not planning understand person again, in place of dismissing it as an unsatisfying total waste of time, think of it as a valuable understanding knowledge,” she explained.	“think about them did you like or not like? How can this direct you towards picking your following individual day, or prioritizing what is essential to you? Is there whatever you may have done to experienced a far better knowledge? More comfortable clothes? Separate locale? Asking to get rid of it earlier?”	['none', 'none', 'none', 'none', 'none']
In France there is little information of this phenomenon available, so we need to carry out extensive work to be able to understand it better and to answer to it.	That’s why the National [Consultative] Ethics Committee will be tasked, before a position on the topic can be taken.	['none', 'none', 'none', 'none', 'none']
If U.S. counterterrorism efforts rely on conventional Army and Marine Corps units stationed abroad—especially in predominantly Muslim countries—	al Qaeda and other violent groups will feed on the anger and resentment generated by this presence to grow their ranks.	['none', 'none', 'none', 'none', 'none']
As homeopathy is a holistic and individualised treatment	consult a qualified homeopath to attain the best results.	['none', 'none', 'none', 'none', 'none']
Surveillance- Workers Compensation, Suspected Cheating Spouse, Activity check, Employee, 'Nanny-Cam', Vehicle/foot Surveillance	Computer Monitoring and more..	['none', 'none', 'none', 'none', 'none']
Saxton skidded to a halt. The male was spectacularly naked, and all Saxton could think about was how he had ridden that…posterior region…to very great delight twice during the day. No, three times, including what they had just done in the shower together. Which was the reason for the lateness..	“How am I supposed to leave the house with you like that?”.	['none', 'none', 'intent', 'none', 'none']
DVD-Code:	S_Cute-979_mai_02	['none', 'none', 'none', 'none', 'none']
Koenig on Tuesday testified that he saw Roser hit Mr Saunders multiple times on the head with an iron bar	after sunset on November 12, 2017.	['topical', 'none', 'none', 'none', 'none']
LT also offers a no-commission version of the game called EZ Baccarat. This version removes the 5% commission and adds a Dragon 7 bet that pays 40-to-1 for a three-card total of 7.	This helps offset some of the actual house edge loss due to participation frequency on the Tie side bet.	['none', 'none', 'none', 'none', 'topical']
He saw great success at locking down the border under Trump	— even though he took a lot of heat for it from the open-border Democrats.	['none', 'none', 'none', 'none', 'none']
She made those remarks in response to the backlash after two of those sponsored trees exist in direct opposition to the word of the Savior, whose birth is the subject of the holiday itself	one by a notorious satanic troll organization and the other by an LGBT group who adorned their tree with slogans like 'Protect Trans Kids.'	['none', 'none', 'none', 'none', 'none']
However, in spite of the net romance and worldwide marriage global recognition	the number of email brides is normally declining due to strict migrants restrictions that had been launched in 2020.	['none', 'none', 'none', 'none', 'none']
A recent study showed that men that tried this product saw	- 67% IMPROVEMENT IN ERECTILE QUALITY. - 48% IMPROVEMENT IN OVERALL SEXUAL FUNCTION. - 78% IMPROVEMENT IN SEXUAL SATISFACTION.	['none', 'none', 'none', 'none', 'none']
Our residential proxy network is composed of real IP addresses from real users	to ensure that you will never be detected or prevented.	['none', 'none', 'none', 'none', 'none']
Today we are unraveling a critical point of discernment in the coming months and years as bible prophecy unfolds, and that is	learning to see past the many dialectics the enemy is using to bring about a unified government and religion.	['none', 'none', 'none', 'none', 'none']
This could trigger jealous outbursts toward complete strangers or even loved ones exactly who relate genuinely to the object of your fixation.	Additionally end up in and come up with inaccurate presumptions about a communicating ranging from this person and you may other people that ends in it is possible to shame to have overreacting.	['none', 'none', 'none', 'none', 'none']
Our Miracle Chaga Tinctures start their journey in Alaska, where wild-harvested Chaga is blended 1:1 with Alaskan glacial water (Eklutna Glacier) and left to rest for 12 months.	The brew is then strained, and purified, then combined with either extraction-grade ethyl alcohol or Bragg’s Apple Cider Vinegar™. It is bottled here in San Francisco by our local team of Chaga experts.	['none', 'none', 'none', 'none', 'none']
Can You Increase Sperm Volume Newflame Fire Equipment Co. Ltd.. Therefore, if Su Cheng let them go, then the Rothschild family penis enhancement Can You Increase Sperm Volume will soon know that Su Cheng killed Cole	This matter is completely settled If you dont put it you can plan a little bit Next..	['none', 'none', 'intent', 'none', 'none']
can you overdose on cbd oil gummies for sleep is the best	and it'sn't peppering for anything too..	['none', 'none', 'none', 'none', 'none']
The aftermath of “Pianogate” abounds with examples. Take that of British Hong Konger, Jazzua Leung, who went to play his home city’s anthem (banned by the CCP) on the by-then infamous piano. After uploading a video of his performance, Leung’s YouTube account was suspended because of spam complaints by CCP trolls.	Or take the example of any member of the crowd of ethnically Chinese Dr K supporters who flocked to see the pianist on his return to St Pancras. One was my friend Lyndon Lee, a Christian refugee, journalist and human rights lawyer. Or there is Namewee, the Taiwanese musician known for satirising Xi’s CCP, who is now plotting a musical collaboration with Dr K, as well as the army of “Overseas Chinese” amateur sleuths from around the world who endeavoured to dissect every aspect of “Pianogate”.	['none', 'topical', 'none', 'none', 'none']
